<?xml version="1.0" encoding="UTF-8"?>
<xs:schema xmlns:xs="http://www.w3.org/2001/XMLSchema">

  <xs:element name="Orders">
    <xs:complexType>
      <xs:sequence>
        <xs:element name="item" maxOccurs="unbounded">
          <xs:complexType>
            <xs:sequence>
              <xs:element name="username" type="xs:string"/>
              <xs:element name="timestamp" type="xs:dateTime"/>
              <xs:element name="total_price" type="xs:decimal"/>
              <xs:element name="items">
                <xs:complexType>
                  <xs:sequence>
                    <xs:element name="item" maxOccurs="unbounded">
                      <xs:complexType>
                        <xs:sequence>
                          <xs:element name="product_id" type="xs:string"/>
                          <xs:element name="name" type="xs:string"/>
                          <xs:element name="quantity" type="xs:integer"/>
                          <xs:element name="price" type="xs:decimal"/>
                          <xs:element name="item_total" type="xs:decimal"/>
                        </xs:sequence>
                      </xs:complexType>
                    </xs:element>
                  </xs:sequence>
                </xs:complexType>
              </xs:element>
            </xs:sequence>
          </xs:complexType>
        </xs:element>
      </xs:sequence>
    </xs:complexType>
  </xs:element>

</xs:schema>
